{
  "id": "act-1",
  "sentence": "Open a change request to raise Pro to $59 on Sept 7?",
  "diff": "--- a/pricing.yaml\n+++ b/pricing.yaml\n@@ -1,3 +1,3 @@\n plan: pro\n-price: 49\n+price: 59\n",
  "memo_markdown": "# Decision memo\n\nWinning branch: hold after Rival A ignores.\n",
  "winning_branch_id": "leaf-rival-a-ignore-hold",
  "root_hash": "fac0a6c8240bdbd9582a82d675ea6c00a7dcd4bc057348f1f400406a256c3a6b",
  "status": "waiting",
  "deny_reason": null
}
